Podcast_id,Episode_name,Speaker_id,Text_Sample
4,A Dog Called Rex,42,"Serious pushed his roughly aside and strode around the table towards Snake whipping his boat as he went, Snape whipped out his own."
4,A Dog Called Rex,45,"I’m great. I’m great. As a quarantine, there’s a lockdown. Or maybe there isn’t. I feel like it’s a fever dream that we all had collectively and we’re slowly waking up out of it. It’s very midsummer’s night’s dream. But, you know, I’m here. I’m here. I’m upright. I’ve been cooking a lot. And hopefully, once the world opens again, I can cook a lot less and eat meals that were not made by my own hands once again."
4,A Dog Called Rex,44,"Yeah. You know, I kind of feel like we came out of the fever dream of the quarantine lockdown. We’re actually stuck a little bit in it. And then I woke up and like my foot was amputated and the world was burning. And we’re having this revolution going on. And you know that, too. So there’s still a lot happening."
4,A Dog Called Rex,46,"Amazing. That was the Milky Way you look and like in the world. And I’m so proud of you for doing equally ashamed as I am proud. It makes me giggle people sugar. So go on that out there like that other way. No, no, no. That was a trash talk."
4,A Dog Called Rex,44,"And so far, we’ve got a special guest with us in our virtual studio today. Bill, who do we have in the House?"
4,A Dog Called Rex,43,Go wild. Go crazy.
4,A Dog Called Rex,42,"Thing is, I’m thrilled to be here. You sound it. Come on. Here we are. All our Zoome windows are us in our homes where this is the podcasting and how we’re doing it now. And it is very strange time for myriad reasons. A very sad, scary, strange time. So it is, I will say, delightful to be locked away in my closet chatting with U2 today. So a highlight of an otherwise very dark and unsettling day."
4,A Dog Called Rex,45,"Amazing thing. That’s always my aim is to be highlights an unsettling day. So, Jason, I know that this is, like he said, a sort of a difficult time. What have you been doing in quarantine to make yourself feel like a human being?"
4,A Dog Called Rex,42,"You know, I I’m I’m starting to get worried that I’m not doing enough to make myself feel like a human being. I feel like I’m slipping into, like, automated life."
4,A Dog Called Rex,47,"And then kind of to your point, a lot of I started traveling a lot more for work and it started to feel a lot more difficult to maintain. Having a dog, because you would either require like boarding that dog all the time or, you know, having it just felt like it would be contributing to a more chaotic life for the dog. Right now, though, yeah, I wish I did. And have and have now. You know, I know a lot of a lot of people are fostering dogs right now. And for a while they were saying a lot of shelters are empty, which is wonderful. But I have thought about doing that now, kind of assuming I think I can presume right now going forward, it’s still going to be a while until there’s such a time where I’m traveling to the degree that I was you know, I don’t think we’re going to jump straight back into touring the podcast that I do or I don’t think I’m going to. I just I spent three months in London on a job last fall. Like, I don’t think I’m going to be jumping around a lot more. So why not?"
4,A Dog Called Rex,42,"Yeah. And it’s and I mean, and to be selfish about it, you know, would I I genuinely believe I think it would be it would very much improve my mood and to be, you know, and, and hopefully like to get a dog out of a shelter would be wonderful. You know, so you know, it’s a Win-Win. Yeah. Let’s do it. Bam! Let’s do it."
4,A Dog Called Rex,44,"I adopted a cat in the middle of all of this. Oh, no. He’s over here in the corner watching me and like the creepy boyfriend she is. She really has, like, saved me because I don’t know what would have happened in the last, like, month and a half if I did not have this other heartbeat with me in my apartment. Yeah. Y’all adopt a dog together? Yeah. I love it. You know, Jason, when you’re traveling, you could just drop it off in New York for burping right here."
4,A Dog Called Rex,47,"And I hosted with Paul Scheer and June Diane Rayfield. And it’s usually the three of us, plus a guest. Have we’ve watched a bad movie? Kind of. The idea behind it is we’ve watched a bad movie and that bad movie can be anything from like the room or Bird Demick or like really bad kind of cult movies to we do all the Fast and Furious movies and the meg and fun stuff like that. And so we have a guest on and we will talk about that stuff and what I’m very lucky or will you know, we’ll do it live. We do it in the studio. And for the most part, this is just me and friends. You know, Paul, in June, I’ve known for 20, almost 20 years now. Most of the guests are people like Adam Scott or Nick Croll or, you know, Chelsea Peretti or all these people who are similarly our peer group and our friends. And so I’ll say there is no real preparation other than a willingness to like and in excitement generate genuinely to get onstage or to get into the studio with friends of mine. Because I know that what the show is really is a conversation amongst friends. And that’s what I think people like about the show. And that’s what I like about doing the show. Like, that’s I will say one of the things I’m missing the most in quarantine is performing. I just really I’m a I’m myself an enormous podcast fan. And so I get excited to go on other podcasts to talk to people who are themselves excited about the stuff they’re talking about. And when I was told that you guys your episode was you guys excited about me?"
4,A Dog Called Rex,45,"So it’s remarkable because when you’re recording these episodes, Nicole and I are kind of in our own world. We know what we’re there to talk about. And it sounds weird to say, but I never, ever imagined the person that we’re talking about ever hearing it, like ever. Yeah. So it’s incredibly odd to be speaking to you about you. I’m going to have more questions. But it’s very it’s like once we have the confirmation that you were going to be on. I kind of had like a very mild stroke. Sure. And I thought, OK."
4,A Dog Called Rex,42,"And I just I just kind of clocked it and I was like, OK, I don’t care. And then we kind of kept going. And in the middle of the meeting, talk turned to podcasts in general. And how what a what is surprising? You know, a big part of societal pop culture is not podcasts. And everybody’s sharing podcasts the way they used to share TV or movie recommendations and blah, blah, blah. And this is that. And I if somebody asked if I had a podcast, I said I did. And I started to describe it. And the woman who I was having a meeting with said, oh, I feel like I’ve heard that podcast before. And I was like, oh, here we go. And then I was like, and it’s like, oh, yes. We did an episode on the movie The Snowman, which you have on your bookshelf over there. And she was like and you could see it wash across her face because she was like, oh, oh, I did listen to that episode of that. I said, like, oh, no. And it was really it led to a very funny conversation. But I was for a moment like, oh, right. We talk about this stuff."
4,A Dog Called Rex,42,"Gross perverts, you know, monsters, charming, hopefully lovable monsters. But, yes, I mean, to to your question, I would like to be considered to play that both the guy that the girl wants to date, you know, like, why can’t I be like I’m in one of the side stories in like the romantic comedy, How to Be Single. And I’m just a guy that runs a bookstore and marries Allison Aubrey in that movie. And to me, I’m like, why can’t I do more of that? Like, that’s nobody was like up in arms when that happened. Nobody was like, no, we won’t allow that. You know, it’s it’s fine. So. Yeah. No, I’d love to. I wish that I was considered more for roles like that, for roles in which I’m not the guy who sadly, though I think it is a lot of times I am cast as the guy that’s like, well, after she broke up with that guy and decided to go crazy. She dates this guy who is the worst."
4,A Dog Called Rex,44,"So to go back to these action movies that you’re watching from your childhood, are these places where you kind of found figured out like your models of masculinity and like who you wanted to, like, be like the kind of man of the kind?"
4,A Dog Called Rex,45,"Oh, my God. I love my life. I think I say this all the time. But I imprinted on Bruce Willis for the longest time. I could not be attracted to someone unless they smoked exactly like Bruce Willis. Smoked as David. Yeah, like I was obsessed with David outas and I feel like he is I’ve I’ve expounded on this theory before, but he is the godfather for so many characters. I feel like without David Addison, there is simply no Nick Miller, a new girl. Yeah. It just doesn’t happen. Like, these people are like direct descendants of a special kind of character. Yeah. David, I think is just like, amazing."
4,Conscious Coupling,46,If I were quarantined with.
4,Conscious Coupling,47,I would let him. And then we would.
4,Conscious Coupling,46,"Oh, boy, you get that out of your system somehow. Yeah, I feel much better now. Okay, good. Fellows, lightless, we wanted to take a moment and say thank you once again for your membership and support, which has become more important than ever, especially in times like these. You’re helping everyone at Slate do the work that they do and we’re doing our best."
4,Conscious Coupling,48,"Put out the best work for you. Now, if you’re a reader of Slate as well as a listener, you might have heard that Slate.com recently installed a paywall. But as Slate Plus members, you have access to everything on the Web site. As long as you’re a member, you will not hit a paywall. All you have to do is sign in as slate that com slash log in that slate, dot com slash log in. And if you have any questions about your account, you can email us at plus at Slate dot com."
4,Conscious Coupling,46,"Hi, Ben. Hello, Nicole. I feel like we’re both very self-conscious about not purring at each other today. You know what? I don’t my purring at you. Thank you. It’s good to shut up. Paul told me everything I need to know. Well, I’d rather you did a pair at me, you weirdo. That’s fair. I get that. Oh, boy. Yeah. So what’s shakin? How’s everything going over there in your part of the world? You, me, my apartment’s you."
4,Conscious Coupling,48,"How are you doing other than hating my very place of existence? And now I’m I’m still doing OK, I guess. But I have reinstalled some dating apps that I deleted. So I’m just like, I need a man to pay attention to me some kind of way. And even though everybody is locked inside, still men do not know how to have a conversation."
4,Conscious Coupling,46,"So congratulations, you played yourself. Seriously, I think I’m thinking about uninstalling everything again because it’s just I shouldn’t have to pull teeth. Like we’re all tired and horny and bored. Just talk. You know, like what you’re saying is not interesting."
4,Conscious Coupling,49,"Nicole, listen, I deleted all those apps a while ago because I knew that there be monsters. And I just didn’t want to have to deal with that at this time. Like, I’m already under a lot of needless stress. I’m far from home. I am tired all the time. I feel like I’ve been battling a series of demons, like just one after the other, sometimes multiple demons at once. So I really wasn’t trying to add to that. People being just unable to engage in human interaction."
4,Conscious Coupling,50,"Well, you know, I think that’s what I’m going to do. I go through those phases where I delete the apps and I think I’m going to do them again. Plus, we here at Thursday, Kate, we have a hiatus coming up and that will help free my mind."
4,Conscious Coupling,49,"But I’m glad you brought up the hiatus, because I know that people have been sending us messages, whether on Twitter or email or on Tumblr, to say how we are an essential part of their quarantine situation, whether that’s going back into the catalog or it is listening to stuff that we’ve been doing these last few weeks. And, you know, people are just being really supportive and kind as they always have been. To be fair. Right."
4,Conscious Coupling,50,"We are not disappearing. We’re just taking a break. Probably still a little active on Twitter with any particular announcements or if anything. You know, incredible happens. Like, I don’t know, Mark Ruffalo leaves his wife and marries me hyper specific."
4,Conscious Coupling,48,"But if anything like that happens, you know, you should look out for news and other announcements on our Twitter page just in general. You never know what you’re going to see. And we’ll let you know when we’re coming back. But we are coming back. We are coming back."
4,Conscious Coupling,49,"I love how we had to reassure guys. We are coming back. But before we go, we have this one episode to give to you a little parting gift so that you can remember us over the next few weeks. Nicole, this is tied into a lot of quarantine activity. You know, I think a lot of us, as we’ve mentioned in previous episodes, a lot of us during this time, those of us who are able to stay at home and work from home and just generally be at home are reaching for familiar and comforting things. So for me, that meant watching Bones with hopefully a more critical eye, but still very much loving the central relationship between Brennan and Booth. Nicole, I know you’ve also been watching some stuff like Superstore and other sitcoms as well."
4,Conscious Coupling,48,"I’ve been watching stuff that’s still currently on the air, like super, as you mentioned, and Brooklyn Nine-Nine. Good girls, of course. As we mentioned in our episode about many Montana A. Just like every, you know, all that kind of stuff. But I’ve also. Yeah, been living on Netflix and Amazon Prime came back through stuff that I’m you know, that I’m already familiar with, that I know how it’s gonna end. There’s no question. There’s no there’s no mystery. And it’s also just fun to like, you know, when you’re with rewatching the stuff to see all the hints and other clues that were dropped beforehand. And when it comes to certain things like, oh, you know, that will they won’t they couple that ends up getting together and then you go back and you see all these little things that have been planted, you know, all the crumbs that we’ve been following. Right."
4,Conscious Coupling,49,"Right. All this to say for the shows that we have been rewatching. There are certain couples that sort of embody the idea of, you know, real love, true love, lasting love, blah, blah, blah, love. And there’s something about watching those couples get together. That is it feeds the beast in me that needs certainty."
4,Conscious Coupling,49,"Like right there in the bowling alley. Like what? And I remember you tweeting about it and you were like, oh, my God, Leslie’s me. And I am Leslie. Like, I also want to clamber across, like, the bowling alley and jump into his arms. The thing about the show, as you mentioned, is that they also each other, each other’s person. But what I really, really, really love about Ben and Leslie is that they are both very good people separately. And yet somehow together they are better, like each person pushes the other one to be the best version of themselves. And that means tamping down their worst urges and raising up their best urges. And that’s not necessarily that they are changing each other."
4,Conscious Coupling,49,"It’s really just a case of just allowing the best facets of their personality to kind of come to the fore. Both of my finest, happiest examples of this is actually in the episode where they get together. So this is Season 4 and we’ve seen them kind of dance around their attraction. Anyway, on this final project that they’re supposed to be doing, which is the smallest park in Pawnee, the littlest park, she invites him to that little park after they’ve had this massive falling out. And she does something that I don’t think a lot of TV shows do or even do nearly as well. She is emotionally naked. She opens up. She puts herself on the line, knowing full well that it could end really badly for her."
4,Conscious Coupling,51,"I’m trying to be a little less intense and a little more considerate here. Hevesi, but only if you want to. OK. Want to? I never listen to what you wanted or how you wanted us to be when things ended between us. I just decided what I wanted and I got upset when you didn’t want the same thing. I know that’s not fair. I’m very sorry. Well, thank you, I appreciate it. If you don’t want to have any more contact with me, I finally understand."
4,Conscious Coupling,51,"There is another option. We could just say, screw it and do this thing for real. Well, I miss you like crazy. Think about you all the time. I want to be with you. So let’s just say screw it."
4,Conscious Coupling,50,"And then, you know, we start seeing that, oh, is there going to be something between Ben and Leslie? And it just moves. It doesn’t move like too quickly, which again, there’s such of a delicate art to making sure that couples get together. You know, it can’t be too soon. It can’t be too far away from the start of everything. But I think the way that they begin to notice each other and see each other and, you know, just kind of recognize that something is happening here."
4,Conscious Coupling,52,"You’re over your man. It’s costing. That’s really helpful. So welcome. I was thinking about you when I wrote it. It was because I told you I wanted to read it. Yeah, a good reason. Anyway, Chris wants to see us in his office. I guess we should head over there. All right. All right. I’ll see you there. I’ll see you there. Benjamin. Ben. All right, Leslie. Leslie. Hi, Ben."
4,Conscious Coupling,53,"Oh, hey. You forgot her name. She literally was like, who? What’s so amazing?"
4,Conscious Coupling,52,That was the most sexual tension I have ever seen in a conversation about documents. It can’t happen. We can both get fired. It’s a dumb rule. I know you have to follow it. I want to suggest avoiding one on one tensioning situations with your own good plan.
4,Conscious Coupling,53,"I still remember Nicole when dealing with Winnie the Pooh. Thank. Yes. Honey, honey, what do you. Why? Why?"
4,Conscious Coupling,54,"Who? This period of lockdown? Well, here’s the thing. There aren’t many. I don’t feel like in the last two years, even though we’ve done such fantastic work in terms of really putting them out there. You know, I was adamant that there’s a real, I would say, market for people who love not like fairies, but people who love animated cartoons and things like that. But so far, I feel like I’m not really good at anything. Great. I’m trying to see what this Robin Hood is going to look like. I thought the last thing that we’ve had that was supposed to be somewhat I don’t know if the last thing I saw was Sonic, I guess. But you know how so I’m not I’m not too impressed at the moment. Not too impressed. I haven’t seen anyone that really catches my eye. The last person was tunnels, which is why I stopped him. However, one person did just come to mind. I’m still in the same arena of being animated and also part animal."
4,Conscious Coupling,54,"He’s got a gold pierced in like he dresses like. I don’t know. He wins. He’s got a fur coat, like fireline coat. He’s got like a texture. He’s hot. I’m telling you. And honestly, when I was on Twitter, I wasn’t saying anything about DA. I did not tweet about the dark skin because I said, you know what, I fancy him, but I don’t want anyone. Everyone else is fat because I feel like this is a safe space. I can. Other than the judgments I do receive is the safest space for me to trivia. But I was like to keep to myself. But I just see tweets to people not wise. Do I actually find guy? I don’t know if you have seen what he looks like or have seen him in the show, but he’s seen."
4,Conscious Coupling,53,"They’re light skinned ox on the show. Like there’s something about him being dark skinned that I think plays a role in this season. Darren, That was just my personal preference to categorize him. I would like our duck skin. OK. I see. Allegedly. I was like, oh, yeah. He’s a wonderful, beautiful basketball. Of course, my boyfriend. Yes, that’s exactly."
4,Conscious Coupling,54,"You’re right. There was actually Dyleski’s. I’m actually just not emotionally stable enough to watch that film. I think that numerous people had said that it made them cry and it was just so beautiful inside. And sometimes I just I’m like, you know what? You guys can keep it. That’s fine. You keep you keep the sadness. And I’ll stick with the. I can’t do it. But I I’ve I’ve looked I brought up the picture of this person and I’ve got some questions. Go on. I was judged. From my earlier comments whilst Willes while the stapler. I’m not to blame about funnels, okay. Uh-Huh. Now taking the the buckin or however people describe the side and also might be a killing half of the hotplate that’s taken out the statue statue wise. I don’t really see how how different it is. Matt. Is it Maui? Yes. 4 from families that are saying how can you not fundamentals. But you can’t see him. Please. I would love to discuss this."
4,Conscious Coupling,54,"OK. That is accurate, I’d say. You know what? The angry penis. Purple. Wow. You put it that way. You’re right. You’re actually good."
4,Conscious Coupling,54,"I believe we just stand up on my pose, you know, sisters. I believe that it only applies to the animated his here’s. I think that the live action remake that they did of STONKING, they made it more animal. Right? I would say that coming for me."
4,Thirsting in Place,55,"I walk into the hotel sauna. The steam parts for a moment and I see that Rodrigo, Tessa Giardina and Henry are already seated."
4,Thirsting in Place,55,"Yes, in a very big way. It turns out that’s the physical presence of Nicole and I in a room creates its own little magic. And that’s just between the two of us. Also, our producer is at another location share. So it’s kind of like three people over a cauldron, but we’re all whipping up our own spells in our own little huts. And so together it’s like, yeah, sure, it’s good, obviously, because we’re experts, professionals, but it’s a little bit more difficult to gauge everything. Right. I didn’t realize. Nicole, how much I required looking at your face. See, you kind of execute some kind of thirsty dance move."
4,Thirsting in Place,56,"Hello, Nicole. How are you today? Let’s see. I’m trying to be present and mindful, et cetera, and figure out how I’m feeling. And it turns out my vocabulary is not that big because I’m like, I don’t know."
4,Thirsting in Place,57,"You know, from my headphones now. But back then, I could look into the whites of your eyes and be like, wow, she is really actively thirsty."
4,Thirsting in Place,58,"Like, you know, we can have that kind of silent communication when we’re ready to move on to the next person or whatever the situation may be. And right now, we don’t have that. And it’s you know, it’s it’s you know, we’re still making magic happen. But like you said, it’s a little more challenging."
4,Thirsting in Place,55,"But all that to say, we have been super grateful for all of our listeners who have been just incredible at lifting our spirits, who have been so great. As we mentioned last week at just telling people about us, making people aware of our back catalogue, we have multiple episodes, just like so many of your faves. Definitely our faves. And I feel like we are now at the place where people say, you know, people will put a request out and say, oh, I’m looking for a podcast. And without fail, several people would jump in and be like, allow me to tell you about the best podcasts of your life. Plus, they get so shoutouts at every single one of the first buckets who’ve just been amazing. Are being a little street team, even though we’re all Endo’s. So shout out to you guys. Thank you very much."
4,Thirsting in Place,59,"Yes. Thank you all so much. We really appreciate it. And we say all that to let you know that we’re not going to have any droplets. This episode, the show is still going to be good because we’re always going to give you the best that we have. But this particular episode, you know, we’re going to get in and get out and."
4,Thirsting in Place,55,"So, yes, a Pulitzer. Apologies that troubles are not going to be on the menu this week. However, we will be back next week stronger and better than ever. But this week, we do have some really remarkable stuff because we once again reached out to our glorious nurse buckets. And it felt odd for us not to address what is going on in the world in the actual episode. So we are looking at this as a sort of thought first experiment."
4,Thirsting in Place,60,"Yeah, I see how I preemptively said thank you because I knew you were going to be impressed. Nicole, thanks. Deserve it. Thank you. It’s like won’t be upset, like. So you’ll be OK? Yes. Thank you. Exactly what I see. The magic is still there."
